<?xml version="1.0" encoding="UTF-8"?>
<analisis xmlns:xsi="http://www.w3.org/2001/XMLSchema-instance" xsi:schemaLocation="http://www.iam.es/repositorio repositorio.xsd" xmlns="http://www.iam.es/repositorio">
	<AnalizadorEstaticos>
		<chequeos>
			<chequeo tipo="ChequeoExistenciaFicheros" nombre="ChequeoExtensionEstaticos" descripcion="Comprobacion de la extenion del archivo de estaticos. La extensión de los archivo de estáticos tiene que ser *.zip ">
				<mensaje>
					<incorrecto>El fichero no tiene la extension adecuada</incorrecto>
					<correcto>El fichero tiene la extension adecuada</correcto>
					<avisos/>
				</mensaje>
				<reglas>
					<regla tipo="ReglaArchivo">
						<ejemplo> .El fichero de estaticos no tiene extensión zip</ejemplo>
						<patronOCadena>.*\.zip</patronOCadena>
						<tipoComprobacion>OBLIGATORIEDAD</tipoComprobacion>
						<tratamientoMayusculas>IGNORAR</tratamientoMayusculas>
					</regla>
				</reglas>
			</chequeo>
			<chequeo tipo="ChequeoExistenciaFicheros" nombre="ChequeoArchivosNoPermitidosEstaticos" descripcion="Ficheros no permitidos dentro del archivo de estaticos. Estan prohibidos los ficheros: thumbs.db, maven, .maven, .class, .jar, .asp, .java, .svn, .log, .jsp ">
				<mensaje>
					<incorrecto> .Se han encontrado fichero no permitidos</incorrecto>
					<correcto> .No existen ficheros no permitido</correcto>
					<avisos> .Hay un fichero que debe ser revisado</avisos>
				</mensaje>
				<reglas>
					<regla tipo="ReglaArchivo">
						<ejemplo> .Existe un fichero thumbs.db que no esta permitido dentro del zip de estaticos</ejemplo>
						<patronOCadena>.*\\thumbs\.db</patronOCadena>
						<tipoComprobacion>PROHIBIDO</tipoComprobacion>
						<tratamientoMayusculas>IGNORAR</tratamientoMayusculas>
					</regla>
					<regla tipo="ReglaArchivo">
						<ejemplo> .Existe un fichero maven que no esta permitido dentro del zip de estaticos</ejemplo>
						<patronOCadena>.*\\maven\\</patronOCadena>
						<tipoComprobacion>PROHIBIDO</tipoComprobacion>
						<tratamientoMayusculas>ESTRICTO</tratamientoMayusculas>
					</regla>
					<regla tipo="ReglaArchivo">
						<ejemplo>.Existe un fichero .maven que no esta permitido dentro del zip de estaticos</ejemplo>
						<patronOCadena>.*\.maven</patronOCadena>
						<tipoComprobacion>PROHIBIDO</tipoComprobacion>
						<tratamientoMayusculas>ESTRICTO</tratamientoMayusculas>
					</regla>
					<regla tipo="ReglaArchivo">
						<ejemplo> .Existe un fichero .class que no esta permitido dentro del zip de estaticos</ejemplo>
						<patronOCadena>.*\.class</patronOCadena>
						<tipoComprobacion>PROHIBIDO</tipoComprobacion>
						<tratamientoMayusculas>ESTRICTO</tratamientoMayusculas>
					</regla>
					<regla tipo="ReglaArchivo">
						<ejemplo> .Existe un fichero .jar que no esta permitido dentro del zip de estaticos</ejemplo>
						<patronOCadena>.*\.jar</patronOCadena>
						<tipoComprobacion>PROHIBIDO</tipoComprobacion>
						<tratamientoMayusculas>ESTRICTO</tratamientoMayusculas>
					</regla>
					<regla tipo="ReglaArchivo">
						<ejemplo> .Existe un fichero .asp que no esta permitido dentro del zip de estaticos</ejemplo>
						<patronOCadena>.*\.asp</patronOCadena>
						<tipoComprobacion>PROHIBIDO</tipoComprobacion>
						<tratamientoMayusculas>ESTRICTO</tratamientoMayusculas>
					</regla>
					<regla tipo="ReglaArchivo">
						<ejemplo> .Existe un fichero .jsp que no esta permitido dentro del zip de estaticos</ejemplo>
						<patronOCadena>.*\.jsp</patronOCadena>
						<tipoComprobacion>PROHIBIDO</tipoComprobacion>
						<tratamientoMayusculas>ESTRICTO</tratamientoMayusculas>
					</regla>
					<regla tipo="ReglaArchivo">
						<ejemplo> .Existe un fichero .java que no esta permitido dentro del zip de estaticos</ejemplo>
						<patronOCadena>.*\.java</patronOCadena>
						<tipoComprobacion>PROHIBIDO</tipoComprobacion>
						<tratamientoMayusculas>ESTRICTO</tratamientoMayusculas>
					</regla>
					<regla tipo="ReglaArchivo">
						<ejemplo> .Existe un fichero .svn que no esta permitido dentro del zip de estaticos</ejemplo>
						<patronOCadena>.*\\\.svn\\</patronOCadena>
						<tipoComprobacion>PROHIBIDO</tipoComprobacion>
						<tratamientoMayusculas>ESTRICTO</tratamientoMayusculas>
					</regla>
					<regla tipo="ReglaArchivo">
						<ejemplo> .Existe un fichero .log que no esta permitido dentro del zip de estaticos</ejemplo>
						<patronOCadena>.*\.log</patronOCadena>
						<tipoComprobacion>PROHIBIDO</tipoComprobacion>
						<tratamientoMayusculas>ESTRICTO</tratamientoMayusculas>
					</regla>
					<regla tipo="ReglaArchivo">
						<ejemplo> .Existe un fichero .jsp que no esta permitido dentro del zip de estaticos</ejemplo>
						<patronOCadena>.*\.jsp</patronOCadena>
						<tipoComprobacion>PROHIBIDO</tipoComprobacion>
						<tratamientoMayusculas>ESTRICTO</tratamientoMayusculas>
					</regla>
					<regla tipo="ReglaArchivo">
						<ejemplo> .Existe un fichero .php que no esta permitido dentro del zip de estaticos</ejemplo>
						<patronOCadena>.*\.php</patronOCadena>
						<tipoComprobacion>EXISTENCIA</tipoComprobacion>
						<tratamientoMayusculas>ESTRICTO</tratamientoMayusculas>
					</regla>
				</reglas>
			</chequeo>
		</chequeos>
		<chequeos>
	</chequeos>
		<chequeos>
	</chequeos>
	</AnalizadorEstaticos>
	<AnalizadorRecursos>
		<chequeos>
		<chequeo tipo="ChequeoExistenciaFicheros" nombre="ChequeoExtensionRecursos" descripcion="Comprobacion de la extenion del archivo de recursos. La extensión de los archivo de recursos tiene que ser *.zip">
				<mensaje>
					<incorrecto> .El fichero no tiene la extension adecuada</incorrecto>
					<correcto> . El fichero tiene la extension adecuada</correcto>
					<avisos/>
				</mensaje>
				<reglas>
					<regla tipo="ReglaArchivo">
						<ejemplo> .El fichero de propiedades de recursos no tiene extensión zip</ejemplo>
						<patronOCadena>.*\.zip</patronOCadena>
						<tipoComprobacion>OBLIGATORIEDAD</tipoComprobacion>
						<tratamientoMayusculas>IGNORAR</tratamientoMayusculas>
					</regla>
				</reglas>
			</chequeo>
			<chequeo tipo="ChequeoExistenciaFicheros" nombre="ChequeoArchivosNoPermitidosRecursos" descripcion="Ficheros no permitidos dentro del archivo de recursos. Estas prohibidos los ficheros: .class, .jar, .asp, .jsp, .java, .svn, .log, ">
				<mensaje>
					<incorrecto> .Se han encontrado fichero no permitidos dentro del archivo de recursos</incorrecto>
					<correcto> .No existen ficheros no permitidos dentro del archivo de recursos</correcto>
					<avisos> .Hay un fichero dentro del archivo de recursos que debe ser revisado</avisos>
				</mensaje>
				<reglas>
				<regla tipo="ReglaArchivo">
						<ejemplo> .Existe un fichero .class que no esta permitido dentro del zip de recursos</ejemplo>
						<patronOCadena>.*\.class</patronOCadena>
						<tipoComprobacion>PROHIBIDO</tipoComprobacion>
						<tratamientoMayusculas>ESTRICTO</tratamientoMayusculas>
					</regla>
					<regla tipo="ReglaArchivo">
						<ejemplo> .Existe un fichero .jar que no esta permitido dentro del zip de recursos</ejemplo>
						<patronOCadena>.*\.jar</patronOCadena>
						<tipoComprobacion>PROHIBIDO</tipoComprobacion>
						<tratamientoMayusculas>ESTRICTO</tratamientoMayusculas>
					</regla>
					<regla tipo="ReglaArchivo">
						<ejemplo> .Existe un fichero .asp que no esta permitido dentro del zip de recursos</ejemplo>
						<patronOCadena>.*\.asp</patronOCadena>
						<tipoComprobacion>PROHIBIDO</tipoComprobacion>
						<tratamientoMayusculas>ESTRICTO</tratamientoMayusculas>
					</regla>
					<regla tipo="ReglaArchivo">
						<ejemplo> .Existe un fichero .jsp que no esta permitido dentro del zip de recursos</ejemplo>
						<patronOCadena>.*\.jsp</patronOCadena>
						<tipoComprobacion>PROHIBIDO</tipoComprobacion>
						<tratamientoMayusculas>ESTRICTO</tratamientoMayusculas>
					</regla>
					<regla tipo="ReglaArchivo">
						<ejemplo> .Existe un fichero .java que no esta permitido dentro del zip de recursos</ejemplo>
						<patronOCadena>.*\.java</patronOCadena>
						<tipoComprobacion>PROHIBIDO</tipoComprobacion>
						<tratamientoMayusculas>ESTRICTO</tratamientoMayusculas>
					</regla>
					<regla tipo="ReglaArchivo">
						<ejemplo> .Existe un fichero .svn que no esta permitido dentro del zip de recursos</ejemplo>
						<patronOCadena>.*\\\.svn\\</patronOCadena>
						<tipoComprobacion>PROHIBIDO</tipoComprobacion>
						<tratamientoMayusculas>ESTRICTO</tratamientoMayusculas>
					</regla>
					<regla tipo="ReglaArchivo">
						<ejemplo> .Existe un fichero .log que no esta permitido dentro del zip de recursos</ejemplo>
						<patronOCadena>.*\.log</patronOCadena>
						<tipoComprobacion>PROHIBIDO</tipoComprobacion>
						<tratamientoMayusculas>ESTRICTO</tratamientoMayusculas>
					</regla>
					
				</reglas>
			</chequeo>
		</chequeos>
	</AnalizadorRecursos>
	<AnalizadorArtefacto>
	   <chequeos>
			<chequeo tipo="ChequeoExistenciaFicheros" nombre="ChequeoExtensionArtefacto" descripcion="Comprobacion de la extenion del artefacto desplegable. El archivo de aplicación JEE tiene extensión *.ear">
				<mensaje>
					<incorrecto> .El archivo de aplicación JEE NO tiene extensión .ear</incorrecto>
					<correcto> .El archivo de aplicación JEE tiene extensión .ear</correcto>
					<avisos/>
				</mensaje>
				<reglas>
					<regla tipo="ReglaArchivo">
						<ejemplo> .El archivo de aplicación JEE NO tiene extensión .ear</ejemplo>
						<patronOCadena>.*\.ear</patronOCadena>
						<tipoComprobacion>OBLIGATORIEDAD</tipoComprobacion>
						<tratamientoMayusculas>IGNORAR</tratamientoMayusculas>
					</regla>
				</reglas>
			</chequeo>
			<chequeo tipo="ChequeoExistenciaFicheros" nombre="ChequeosEstructura" descripcion="Comprobacion de la estructura de EAR. Los archivos .ear deben incluir la carpeta META-INF ">
				<mensaje>
					<incorrecto> .Los archivos .ear NO incluyen la carpeta META-INF</incorrecto>
					<correcto> .Los archivos .ear deben incluir la carpeta META-INF</correcto>
					<avisos/>